{
  "schemaVersion": "1.0.0",
  "protocol": "static-sweep-v3",
  "sessionId": "0f5a1c3e-6b21-4d7f-9a08-1c2d3e4f5a6b",
  "site": "EXAMPLE-SITE-NOT-A-REAL-RUN",
  "operator": "operator-a",
  "deviceUnit": "unit-01",
  "truthReference": "survey-line-2026-04",
  "truthTier": "TIER_2",
  "truthExpandedUncertaintyDeg": 0.18,
  "truthCoverageFactor": 2,
  "fixture": "nonmag-jig-02",
  "headingsDeg": [
    0,
    15,
    30,
    45,
    60,
    75,
    90,
    105,
    120,
    135,
    150,
    165,
    180,
    195,
    210,
    225,
    240,
    255,
    270,
    285,
    300,
    315,
    330,
    345
  ],
  "repetitions": 10,
  "measurementMode": "FLAT_TOP_EDGE",
  "placementMethod": "NONMAGNETIC_ALIGNMENT_JIG",
  "placementProfileId": "nonmag-jig-02-operator-a",
  "placementProfileHash": "sha256:8ed1496b4de8e9cd7eee7c5569bcf786aba72624b32424ef2f96b81bb6a903b1",
  "settleS": 5,
  "captureS": 10,
  "randomizationSeed": 834221,
  "configVersion": "precision-v1-candidate-1",
  "configHash": "sha256:e85a0eb4073a38c43828a294db750c7ee3ca5b7a17165b34650c8c40a99fab6f",
  "fengShuiRuleSetVersion": "fengshui-v1",
  "fengShuiRuleSetHash": "sha256:d4f26003d72adb892ce4868abcfb3a5c8403850f29d111a55f2aad9f71270493",
  "geomagneticModelId": "WMM2025",
  "geomagneticCoefficientHash": "NOT_VENDORED",
  "geomagneticErrorModelHash": "NOT_VENDORED",
  "engineVersion": "heading-3.2.0",
  "engineDecisionLogicHash": "sha256:64a844e67c0a485dd3ce0cbed2f1c27324b2baaa0e11395928ed3ffe047824c6"
}
